{
  "$schema": "http://json-schema.org/draft-07/schema#",
  "$id": "execution_validator_output_schema.json",
  "title": "ExecutionValidatorAgentOutput",
  "description": "Output schema for ExecutionValidatorAgent - validates simulation execution completed correctly",
  "type": "object",
  "required": ["stage_id", "verdict", "execution_status", "files_check", "summary"],
  "properties": {
    "stage_id": {
      "type": "string",
      "description": "ID of the stage being validated"
    },
    "verdict": {
      "type": "string",
      "enum": ["pass", "warning", "fail"],
      "description": "Overall verdict on execution validity"
    },
    "execution_status": {
      "type": "object",
      "description": "Status of simulation execution",
      "properties": {
        "completed": { "type": "boolean" },
        "exit_code": { "type": "integer" },
        "runtime_seconds": { "type": "number" },
        "memory_peak_mb": { "type": "number" },
        "timed_out": { "type": "boolean" }
      },
      "required": ["completed"]
    },
    "files_check": {
      "type": "object",
      "description": "Verification of expected output files",
      "properties": {
        "expected_files": {
          "type": "array",
          "items": { "type": "string" }
        },
        "found_files": {
          "type": "array",
          "items": { "type": "string" }
        },
        "missing_files": {
          "type": "array",
          "items": { "type": "string" }
        },
        "all_present": { "type": "boolean" }
      },
      "required": ["expected_files", "found_files", "missing_files", "all_present"]
    },
    "data_quality": {
      "type": "object",
      "description": "Quality checks on output data",
      "properties": {
        "nan_detected": { "type": "boolean" },
        "inf_detected": { "type": "boolean" },
        "negative_where_unexpected": { "type": "boolean" },
        "suspicious_values": {
          "type": "array",
          "items": {
            "type": "object",
            "properties": {
              "file": { "type": "string" },
              "issue": { "type": "string" }
            }
          }
        }
      }
    },
    "errors_detected": {
      "type": "array",
      "description": "Errors found in execution logs",
      "items": {
        "type": "object",
        "properties": {
          "error_type": { "type": "string" },
          "message": { "type": "string" },
          "location": { "type": "string" },
          "severity": { "type": "string", "enum": ["critical", "warning", "info"] }
        },
        "required": ["error_type", "message"]
      }
    },
    "warnings": {
      "type": "array",
      "description": "Warnings that don't fail validation but should be noted",
      "items": { "type": "string" }
    },
    "stdout_summary": {
      "type": "string",
      "description": "Summary of relevant stdout output"
    },
    "stderr_summary": {
      "type": "string",
      "description": "Summary of stderr output if any"
    },
    "recovery_suggestion": {
      "type": "string",
      "description": "Suggestion for fixing execution failures"
    },
    "summary": {
      "type": "string",
      "description": "One paragraph summary of execution validation"
    }
  }
}

